{
  "schema_version": "dr-deepseek-canary-execution-plan-v1",
  "provider": "deepseek",
  "model_id": "deepseek-flash",
  "endpoint": "https://api.deepseek.com/chat/completions",
  "channel": "ordinary_model_api",
  "text_only": true,
  "tools_enabled": false,
  "vision_enabled": false,
  "video_enabled": false,
  "files_enabled": false,
  "web_enabled": false,
  "parallel_enabled": false,
  "fallback_enabled": false,
  "thinking": "enabled",
  "reasoning_effort": "low",
  "stage": "planner",
  "max_provider_calls": 1,
  "max_retries": 0,
  "max_input_tokens": 2048,
  "max_output_tokens": 4096,
  "operation_timeout_seconds": 60,
  "run_deadline_seconds": 180,
  "monetary_budget_currency": "USD",
  "monetary_budget_limit": "0.02",
  "pricing_type": "peak",
  "input_price_per_million_tokens": "0.30",
  "output_price_per_million_tokens": "1.20",
  "cache_hit_input_price_per_million_tokens": "0.006",
  "approval_state": "design_only_pending_canary",
  "credential_environment_variable": "DEEPSEEK_API_KEY",
  "canary_attempt_id": "deepseek-flash-text-canary-002",
  "task_id": "dr-task-111111111111111111111111",
  "brief_id": "dr-brief-222222222222222222222222",
  "run_id": "dr-run-55ad818f4f600f6ca7b4e28c",
  "artifact_dir": "outputs/deep_research/canary/v1/dr-run-55ad818f4f600f6ca7b4e28c",
  "implementation_commit_sha": "6c4c66f8eec9d8f653df57cae2910198fe21b206",
  "runtime_source_sha256": "ba064273be7cd7ea3d36fd495197db4aca46bad31bdede63dccbb728e90c9d4f"
}
